number,value,datetime_start,datetime_complete,duration,params_batch_size,params_dropout_l1,params_dropout_l2,params_dropout_l3,params_layer_type,params_learning_rate,params_look_back,params_n_layers,params_units_l1,params_units_l2,params_units_l3,user_attrs_n_epochs_trained,state
0,0.0013462395872920752,2026-08-25 11:08:22.110332,2026-08-25 11:08:54.409905,0 days 00:00:32.299573,128,0.2,,,lstm,0.005399484409787433,24,1,32,,,50.0,COMPLETE
1,0.001460251514799893,2026-08-25 11:08:54.413442,2026-08-25 11:24:46.219074,0 days 00:15:51.805632,128,0.05,0.1,0.4,bilstm,0.00025081156860452336,24,3,128,256.0,256.0,50.0,COMPLETE
2,0.0013409653911367059,2026-08-25 11:24:46.221917,2026-08-25 11:28:12.188058,0 days 00:03:25.966141,64,0.4,,,bilstm,0.0004473636174621265,12,1,256,,,50.0,COMPLETE
3,0.0020482433028519154,2026-08-25 11:28:12.193450,2026-08-25 11:38:21.538360,0 days 00:10:09.344910,32,0.25,,,bilstm,0.0005211124595788269,48,1,256,,,22.0,COMPLETE
4,0.0014998808037489653,2026-08-25 11:38:21.542892,2026-08-25 11:44:44.922496,0 days 00:06:23.379604,128,0.1,0.45,,lstm,0.0007162786999897341,48,2,96,128.0,,50.0,COMPLETE
5,0.005140743684023619,2026-08-25 11:44:44.925577,2026-08-25 11:45:31.530398,0 days 00:00:46.604821,128,0.5,,,bilstm,0.00016599837974449222,48,1,64,,,,PRUNED
6,0.0013968211133033037,2026-08-25 11:45:31.532063,2026-08-25 11:48:47.693018,0 days 00:03:16.160955,128,0.25,,,lstm,0.0009874088417386254,48,1,128,,,50.0,COMPLETE
7,0.003068800549954176,2026-08-25 11:48:47.695325,2026-08-25 11:50:06.606881,0 days 00:01:18.911556,128,0.25,0.05,,bilstm,0.0018391267498289018,12,2,192,256.0,,,PRUNED
8,0.0036617934238165617,2026-08-25 11:50:06.609034,2026-08-25 11:54:49.138585,0 days 00:04:42.529551,128,0.45,0.0,0.35000000000000003,bilstm,0.0012894414393074191,48,3,32,192.0,256.0,,PRUNED
9,0.003573188092559576,2026-08-25 11:54:49.140814,2026-08-25 11:57:31.841301,0 days 00:02:42.700487,16,0.25,0.35000000000000003,0.5,lstm,0.0020664542018650088,24,3,64,128.0,96.0,,PRUNED
10,0.003729279385879636,2026-08-25 11:57:31.842261,2026-08-25 11:59:10.109971,0 days 00:01:38.267710,64,0.4,0.25,,bilstm,0.007321173243252608,12,2,256,96.0,,,PRUNED
11,0.0017298083985224366,2026-08-25 11:59:10.110784,2026-08-25 12:00:04.056893,0 days 00:00:53.946109,64,0.35000000000000003,,,lstm,0.006474499730038168,72,1,32,,,25.0,COMPLETE
12,0.003148149698972702,2026-08-25 12:00:04.060197,2026-08-25 12:00:34.307120,0 days 00:00:30.246923,64,0.1,,,lstm,0.00010520137692051975,12,1,256,,,,PRUNED
13,0.0032412586733698845,2026-08-25 12:00:34.308459,2026-08-25 12:01:03.849266,0 days 00:00:29.540807,32,0.35000000000000003,0.5,,lstm,0.003498317056382218,24,2,32,32.0,,,PRUNED
14,0.002633770229294896,2026-08-25 12:01:03.850288,2026-08-25 12:10:23.580691,0 days 00:09:19.730403,16,0.15000000000000002,,,bilstm,0.0004169408564985973,72,1,192,,,,PRUNED
15,0.001642734743654728,2026-08-25 12:10:23.584853,2026-08-25 12:11:18.777395,0 days 00:00:55.192542,64,0.35000000000000003,,,lstm,0.00368492090984572,24,1,96,,,,PRUNED
16,0.0022263939026743174,2026-08-25 12:11:18.778856,2026-08-25 12:12:47.196493,0 days 00:01:28.417637,64,0.0,0.2,,bilstm,0.0003565381239616662,12,2,256,64.0,,,PRUNED
17,0.0023358091711997986,2026-08-25 12:12:47.199074,2026-08-25 12:13:02.274423,0 days 00:00:15.075349,32,0.2,,,lstm,0.003819881924230571,24,1,32,,,,PRUNED
18,0.0040865009650588036,2026-08-25 12:13:02.275319,2026-08-25 12:14:11.120373,0 days 00:01:08.845054,16,0.5,0.35000000000000003,,lstm,0.00011152977421811869,12,2,32,192.0,,,PRUNED
19,0.002791420789435506,2026-08-25 12:14:11.121203,2026-08-25 12:17:57.631915,0 days 00:03:46.510712,64,0.4,,,bilstm,0.0002326005362437407,72,1,256,,,,PRUNED
20,0.002903534099459648,2026-08-25 12:17:57.634382,2026-08-25 12:19:04.773608,0 days 00:01:07.139226,128,0.30000000000000004,,,bilstm,0.009232204784220417,24,1,192,,,,PRUNED
21,0.002385539235547185,2026-08-25 12:19:04.774498,2026-08-25 12:19:49.136540,0 days 00:00:44.362042,128,0.2,,,lstm,0.0008078320352814241,48,1,128,,,,PRUNED
22,0.002154962159693241,2026-08-25 12:19:49.137388,2026-08-25 12:20:33.434710,0 days 00:00:44.297322,128,0.15000000000000002,,,lstm,0.0008626614246685132,48,1,128,,,,PRUNED
23,0.001265043392777443,2026-08-25 12:20:33.436703,2026-08-25 12:21:26.583873,0 days 00:00:53.147170,128,0.2,,,lstm,0.0015022554604420646,12,1,128,,,50.0,COMPLETE
24,0.0012169573456048965,2026-08-25 12:21:26.584748,2026-08-25 12:22:19.433366,0 days 00:00:52.848618,128,0.15000000000000002,,,lstm,0.0020851709656431595,12,1,128,,,50.0,COMPLETE
25,0.0010714579839259386,2026-08-25 12:22:19.434416,2026-08-25 12:23:36.532687,0 days 00:01:17.098271,64,0.0,,,lstm,0.0018465077005649928,12,1,128,,,50.0,COMPLETE
26,0.002623254433274269,2026-08-25 12:23:36.536215,2026-08-25 12:24:32.333096,0 days 00:00:55.796881,16,0.0,0.15000000000000002,,lstm,0.0019105525287979918,12,2,128,32.0,,,PRUNED
27,0.0038114101625978947,2026-08-25 12:24:32.335431,2026-08-25 12:24:58.698733,0 days 00:00:26.363302,32,0.05,,,lstm,0.002620134884942551,12,1,128,,,,PRUNED
28,0.0011953075882047415,2026-08-25 12:24:58.700534,2026-08-25 12:25:52.889939,0 days 00:00:54.189405,128,0.1,,,lstm,0.0013496634370626889,12,1,128,,,50.0,COMPLETE
29,0.0011538516264408827,2026-08-25 12:25:52.891662,2026-08-25 12:26:47.345999,0 days 00:00:54.454337,128,0.05,,,lstm,0.0013018328471791055,12,1,128,,,50.0,COMPLETE
30,0.0010919022606685758,2026-08-25 12:26:47.348440,2026-08-25 12:29:31.974984,0 days 00:02:44.626544,64,0.05,0.30000000000000004,,lstm,0.0011176913722286434,12,2,128,96.0,,50.0,COMPLETE
31,0.0011504858266562223,2026-08-25 12:29:31.977323,2026-08-25 12:32:16.869568,0 days 00:02:44.892245,64,0.05,0.30000000000000004,,lstm,0.0011370949873022278,12,2,128,96.0,,50.0,COMPLETE
32,0.0011239174054935575,2026-08-25 12:32:16.872065,2026-08-25 12:35:00.789377,0 days 00:02:43.917312,64,0.05,0.30000000000000004,,lstm,0.0010963544415050533,12,2,128,96.0,,50.0,COMPLETE
33,0.0019890014082193375,2026-08-25 12:35:00.791846,2026-08-25 12:35:38.998911,0 days 00:00:38.207065,64,0.05,0.30000000000000004,,lstm,0.0006088867146076908,12,2,128,96.0,,,PRUNED
34,0.001151394098997116,2026-08-25 12:35:39.001189,2026-08-25 12:39:54.517799,0 days 00:04:15.516610,64,0.0,0.4,0.0,lstm,0.001016204246116055,12,3,128,96.0,128.0,50.0,COMPLETE
35,0.0011215748963877559,2026-08-25 12:39:54.520361,2026-08-25 12:42:34.811411,0 days 00:02:40.291050,64,0.0,0.25,,lstm,0.00254998984957478,12,2,128,96.0,,50.0,COMPLETE
36,0.0011053152848035097,2026-08-25 12:42:34.814090,2026-08-25 12:44:54.864710,0 days 00:02:20.050620,64,0.0,0.25,,lstm,0.0025846522393053266,12,2,96,96.0,,50.0,COMPLETE
37,0.001192830502986908,2026-08-25 12:44:54.869713,2026-08-25 12:48:05.182334,0 days 00:03:10.312621,64,0.0,0.2,0.0,lstm,0.002780933474503896,12,3,96,96.0,64.0,50.0,COMPLETE
38,0.0016646797303110361,2026-08-25 12:48:05.184791,2026-08-25 12:48:59.978284,0 days 00:00:54.793493,64,0.0,0.2,,lstm,0.004482516649598067,12,2,96,96.0,,,PRUNED
39,0.002299365121871233,2026-08-25 12:48:59.980707,2026-08-25 12:51:12.163660,0 days 00:02:12.182953,64,0.1,0.25,,lstm,0.0025614148813941505,72,2,96,64.0,,,PRUNED
